{
  "language": "python",
  "advertised": true,
  "tier": "first-class",
  "grammar": {
    "name": "tree-sitter-python",
    "version": "0.25.0",
    "adr": "docs/adr/0027-grammar-and-provider-selection.md"
  },
  "precise_provider": {
    "name": "pyright",
    "adr": "docs/adr/0027-grammar-and-provider-selection.md",
    "status": "integrated"
  },
  "capabilities": {
    "DISC-01": {"status": "pass", "mechanism": "chakra-git discovery (.py/.pyi)", "evidence": ["crates/chakra-language-python/tests/fixture_index.rs", "crates/chakra-git/src/discovery.rs"]},
    "DISC-02": {"status": "pass", "mechanism": "pyproject.toml scopes and setup.py/setup.cfg project boundaries", "evidence": ["crates/chakra-git/src/source_metadata.rs", "docs/support/conformance/python.json"]},
    "DISC-03": {"status": "pass", "mechanism": "language-neutral source roles plus test_*.py/*_test.py and tests/ conventions (ADR-0019)", "evidence": ["crates/chakra-git/src/source_metadata.rs", "docs/support/conformance/python.json"]},
    "SYNTAX-01": {"status": "pass", "mechanism": "tree-sitter-python 0.25.0", "evidence": ["Cargo.toml"]},
    "SYNTAX-02": {"status": "pass", "mechanism": "tree-sitter", "evidence": ["crates/chakra-language-python/tests/fixture_index.rs"]},
    "SYNTAX-03": {"status": "pass", "mechanism": "tree-sitter (module/class/function nesting)", "evidence": ["crates/chakra-language-python/tests/fixture_index.rs"]},
    "SYNTAX-04": {"status": "pass", "mechanism": "tree-sitter (import/from-import statements and aliases, relative imports)", "evidence": ["crates/chakra-language-python/tests/fixture_index.rs"]},
    "SYNTAX-05": {"status": "pass", "mechanism": "tree-sitter (byte-accurate ranges)", "evidence": ["crates/chakra-language-python/tests/fixture_index.rs"]},
    "SYNTAX-06": {"status": "pass", "mechanism": "tree-sitter + pytest test_*/unittest conventions", "evidence": ["crates/chakra-language-python/tests/fixture_index.rs"]},
    "SYNTAX-07": {"status": "pass", "mechanism": "tree-sitter diagnostics (ADR-0022)", "evidence": ["crates/chakra-language-python/tests/fixture_index.rs"]},
    "SYNTAX-08": {"status": "pass", "mechanism": "bounded lazy syntax call candidates with import-alias resolution (ADR-0010)", "evidence": ["crates/chakra-language-python/tests/fixture_index.rs"]},
    "PRECISE-01": {"status": "pass", "mechanism": "recorded provider selection: pyright (1.1.4xx)", "evidence": ["docs/adr/0027-grammar-and-provider-selection.md"]},
    "PRECISE-02": {"status": "pass", "mechanism": "pyright over shared chakra-lsp client", "evidence": ["crates/chakra-provider-pyright/tests/lifecycle.rs"]},
    "PRECISE-03": {"status": "pass", "mechanism": "owned lifecycle, restart, orphan-free shutdown (ADR-0032)", "evidence": ["crates/chakra-provider-pyright/tests/lifecycle.rs", "crates/chakra-lsp/tests/lifecycle.rs"]},
    "PRECISE-04": {"status": "pass", "mechanism": "capability-gated enrichment through PreciseProvider", "evidence": ["crates/chakra-provider-pyright/tests/lifecycle.rs"]},
    "PRECISE-05": {"status": "pass", "mechanism": "graceful absence/crash degradation to syntax tier", "evidence": ["crates/chakra-provider-pyright/tests/lifecycle.rs"]},
    "QUERY-01": {"status": "pass", "mechanism": "chakra-engine QueryService", "evidence": ["crates/chakra-engine/tests/scenario.rs"]},
    "QUERY-02": {"status": "pass", "mechanism": "chakra-mcp", "evidence": ["crates/chakra-mcp/tests/contract.rs"]},
    "QUERY-03": {"status": "pass", "mechanism": "chakra-git diff provider", "evidence": ["docs/support/conformance/python.json"]},
    "FRESH-01": {"status": "pass", "mechanism": "atomic revision publication (ADR-0001)", "evidence": ["crates/chakra-engine/tests/atomic_revisions.rs"]},
    "FRESH-02": {"status": "pass", "mechanism": "live freshness barrier (ADR-0005)", "evidence": ["crates/chakra-engine/tests/freshness.rs"]},
    "PROV-01": {"status": "pass", "mechanism": "domain provenance model", "evidence": ["crates/chakra-engine/tests/scenario.rs"]},
    "AMBIG-01": {"status": "pass", "mechanism": "query-layer ambiguity reporting", "evidence": ["crates/chakra-engine/tests/scenario.rs"]},
    "BUDGET-01": {"status": "pass", "mechanism": "query work budgets (ADR-0025)", "evidence": ["crates/chakra-engine/tests/query_work_budgets.rs"]},
    "CANCEL-01": {"status": "pass", "mechanism": "cooperative cancellation (ADR-0025)", "evidence": ["crates/chakra-engine/tests/query_work_budgets.rs"]},
    "DEGRADE-01": {"status": "pass", "mechanism": "bounded degradation (ADR-0011)", "evidence": ["crates/chakra-engine/tests/query_work_budgets.rs"]},
    "CONFORM-01": {"status": "pass", "mechanism": "chakra-conformance harness", "evidence": ["docs/support/conformance/python.json"]},
    "CORPUS-01": {"status": "pass", "mechanism": "pinned public corpus evaluation (ADR-0029)", "evidence": ["docs/support/corpus/results/python-django__django.json"]},
    "DOCS-01": {"status": "pass", "mechanism": "per-language documentation", "evidence": ["docs/languages/python.md"]}
  },
  "conformance_results": "docs/support/conformance/python.json",
  "corpus_results": "docs/support/corpus/results/python-django__django.json",
  "docs": "docs/languages/python.md"
}
