{
  "language": "shell",
  "advertised": true,
  "tier": "first-class",
  "grammar": {
    "name": "tree-sitter-bash",
    "version": "0.25.1",
    "adr": "docs/adr/0027-grammar-and-provider-selection.md"
  },
  "precise_provider": {
    "name": "bash-language-server",
    "adr": "docs/adr/0038-bash-language-server-reference-enrichment.md",
    "status": "integrated"
  },
  "capabilities": {
    "DISC-01": {
      "status": "pass",
      "mechanism": "chakra-git discovery (.sh/.bash/.zsh/.ksh)",
      "evidence": [
        "crates/chakra-language-shell/tests/fixture_index.rs",
        "crates/chakra-git/src/discovery.rs"
      ]
    },
    "DISC-02": {
      "status": "pass",
      "mechanism": "nearest .shellcheckrc/shellcheckrc project scope with path fallback",
      "evidence": [
        "crates/chakra-git/src/source_metadata.rs",
        "docs/support/conformance/shell.json"
      ]
    },
    "DISC-03": {
      "status": "pass",
      "mechanism": "language-neutral test/vendor/generated roles from Shell path conventions",
      "evidence": [
        "crates/chakra-language-shell/tests/fixture_index.rs",
        "docs/support/conformance/shell.json"
      ]
    },
    "SYNTAX-01": {
      "status": "pass",
      "mechanism": "tree-sitter-bash 0.25.1",
      "evidence": ["Cargo.toml"]
    },
    "SYNTAX-02": {
      "status": "pass",
      "mechanism": "tree-sitter",
      "evidence": ["crates/chakra-language-shell/tests/fixture_index.rs"]
    },
    "SYNTAX-03": {
      "status": "pass",
      "mechanism": "tree-sitter (script modules and nested/top-level functions)",
      "evidence": ["crates/chakra-language-shell/tests/fixture_index.rs"]
    },
    "SYNTAX-04": {
      "status": "pass",
      "mechanism": "tree-sitter (source/dot imports and aliases)",
      "evidence": [
        "crates/chakra-language-shell/tests/fixture_index.rs",
        "docs/support/conformance/shell.json"
      ]
    },
    "SYNTAX-05": {
      "status": "pass",
      "mechanism": "tree-sitter (byte-accurate ranges)",
      "evidence": ["crates/chakra-language-shell/tests/fixture_index.rs"]
    },
    "SYNTAX-06": {
      "status": "pass",
      "mechanism": "tree-sitter + test function/file conventions",
      "evidence": [
        "crates/chakra-language-shell/tests/fixture_index.rs",
        "docs/support/conformance/shell.json"
      ]
    },
    "SYNTAX-07": {
      "status": "pass",
      "mechanism": "tree-sitter diagnostics (ADR-0022)",
      "evidence": ["crates/chakra-language-shell/tests/fixture_index.rs"]
    },
    "SYNTAX-08": {
      "status": "pass",
      "mechanism": "bounded static command candidates and Chakra-owned local function edges (ADR-0038)",
      "evidence": [
        "crates/chakra-language-shell/tests/fixture_index.rs",
        "docs/adr/0038-bash-language-server-reference-enrichment.md"
      ]
    },
    "PRECISE-01": {
      "status": "pass",
      "mechanism": "recorded provider selection: bash-language-server 5.6.x plus Chakra-owned outgoing equivalent",
      "evidence": [
        "docs/adr/0027-grammar-and-provider-selection.md",
        "docs/adr/0038-bash-language-server-reference-enrichment.md"
      ]
    },
    "PRECISE-02": {
      "status": "pass",
      "mechanism": "bash-language-server references/document symbols over shared chakra-lsp client",
      "evidence": ["crates/chakra-provider-bash-language-server/tests/lifecycle.rs"]
    },
    "PRECISE-03": {
      "status": "pass",
      "mechanism": "owned lifecycle, revision-scoped Shell document synchronization, restart, cancellation, and orphan-free shutdown",
      "evidence": [
        "crates/chakra-provider-bash-language-server/tests/lifecycle.rs",
        "crates/chakra-lsp/tests/lifecycle.rs",
        "docs/adr/0038-bash-language-server-reference-enrichment.md"
      ]
    },
    "PRECISE-04": {
      "status": "pass",
      "mechanism": "capability-gated incoming reference enrichment through PreciseProvider; outgoing remains syntax-derived",
      "evidence": ["crates/chakra-provider-bash-language-server/tests/lifecycle.rs"]
    },
    "PRECISE-05": {
      "status": "pass",
      "mechanism": "graceful absence/crash/capability degradation to syntax tier",
      "evidence": [
        "crates/chakra-provider-bash-language-server/tests/lifecycle.rs",
        "docs/support/conformance/shell.json"
      ]
    },
    "QUERY-01": {
      "status": "pass",
      "mechanism": "chakra-engine QueryService",
      "evidence": ["crates/chakra-language-shell/tests/fixture_index.rs"]
    },
    "QUERY-02": {
      "status": "pass",
      "mechanism": "chakra-mcp",
      "evidence": ["crates/chakra-mcp/tests/contract.rs"]
    },
    "QUERY-03": {
      "status": "pass",
      "mechanism": "chakra-git diff provider",
      "evidence": ["docs/support/conformance/shell.json"]
    },
    "FRESH-01": {
      "status": "pass",
      "mechanism": "atomic revision publication (ADR-0001)",
      "evidence": ["crates/chakra-engine/tests/atomic_revisions.rs"]
    },
    "FRESH-02": {
      "status": "pass",
      "mechanism": "Shell live freshness barrier and language-partition reconciliation",
      "evidence": ["crates/chakra-language/tests/live_updates.rs"]
    },
    "PROV-01": {
      "status": "pass",
      "mechanism": "domain provenance model including BashLanguageServer",
      "evidence": [
        "crates/chakra-language-shell/tests/fixture_index.rs",
        "crates/chakra-provider-bash-language-server/tests/lifecycle.rs"
      ]
    },
    "AMBIG-01": {
      "status": "pass",
      "mechanism": "query-layer ambiguity reporting",
      "evidence": ["docs/support/conformance/shell.json"]
    },
    "BUDGET-01": {
      "status": "pass",
      "mechanism": "query and index work budgets (ADR-0025)",
      "evidence": [
        "docs/support/conformance/shell.json",
        "docs/support/corpus/results/shell-ohmyzsh__ohmyzsh.json"
      ]
    },
    "CANCEL-01": {
      "status": "pass",
      "mechanism": "cooperative syntax and provider cancellation",
      "evidence": [
        "crates/chakra-language-shell/src/indexer.rs",
        "crates/chakra-provider-bash-language-server/tests/lifecycle.rs"
      ]
    },
    "DEGRADE-01": {
      "status": "pass",
      "mechanism": "bounded degradation (ADR-0011)",
      "evidence": ["docs/support/conformance/shell.json"]
    },
    "CONFORM-01": {
      "status": "pass",
      "mechanism": "chakra-conformance harness",
      "evidence": ["docs/support/conformance/shell.json"]
    },
    "CORPUS-01": {
      "status": "pass",
      "mechanism": "pinned ohmyzsh and nvm public-corpus evaluation (ADR-0029)",
      "evidence": [
        "docs/support/corpus/results/shell-ohmyzsh__ohmyzsh.json",
        "docs/support/corpus/results/shell-nvm-sh__nvm.json"
      ]
    },
    "DOCS-01": {
      "status": "pass",
      "mechanism": "per-language documentation",
      "evidence": ["docs/languages/shell.md"]
    }
  },
  "conformance_results": "docs/support/conformance/shell.json",
  "corpus_results": "docs/support/corpus/results/shell-ohmyzsh__ohmyzsh.json",
  "docs": "docs/languages/shell.md"
}
