{
  "language": "rust",
  "advertised": true,
  "tier": "first-class",
  "grammar": {
    "name": "tree-sitter-rust",
    "version": "0.24",
    "adr": "docs/adr/0004-rust-syntax-index.md"
  },
  "precise_provider": {
    "name": "rust-analyzer",
    "adr": "docs/adr/0006-rust-analyzer-precise-enrichment.md",
    "status": "integrated"
  },
  "capabilities": {
    "DISC-01": {"status": "pass", "mechanism": "chakra-git discovery", "evidence": ["crates/chakra-language-rust/tests/fixture_index.rs"]},
    "DISC-02": {"status": "pass", "mechanism": "cargo-aware scopes", "evidence": ["crates/chakra-git/src/source_metadata.rs", "docs/support/conformance/rust.json"]},
    "DISC-03": {"status": "pass", "mechanism": "language-neutral source roles (ADR-0019)", "evidence": ["crates/chakra-git/src/source_metadata.rs", "docs/support/conformance/rust.json"]},
    "SYNTAX-01": {"status": "pass", "mechanism": "tree-sitter-rust 0.24", "evidence": ["Cargo.toml"]},
    "SYNTAX-02": {"status": "pass", "mechanism": "tree-sitter", "evidence": ["crates/chakra-language-rust/tests/fixture_index.rs"]},
    "SYNTAX-03": {"status": "pass", "mechanism": "tree-sitter", "evidence": ["crates/chakra-language-rust/tests/fixture_index.rs"]},
    "SYNTAX-04": {"status": "pass", "mechanism": "tree-sitter", "evidence": ["crates/chakra-language-rust/tests/fixture_index.rs"]},
    "SYNTAX-05": {"status": "pass", "mechanism": "tree-sitter", "evidence": ["crates/chakra-language-rust/tests/fixture_index.rs"]},
    "SYNTAX-06": {"status": "pass", "mechanism": "tree-sitter", "evidence": ["crates/chakra-language-rust/tests/fixture_index.rs"]},
    "SYNTAX-07": {"status": "pass", "mechanism": "tree-sitter diagnostics (ADR-0022)", "evidence": ["crates/chakra-language/tests/live_updates.rs"]},
    "SYNTAX-08": {"status": "pass", "mechanism": "lazy syntax call sites (ADR-0010)", "evidence": ["crates/chakra-language-rust/tests/fixture_index.rs"]},
    "PRECISE-01": {"status": "pass", "mechanism": "rust-analyzer", "evidence": ["docs/adr/0006-rust-analyzer-precise-enrichment.md"]},
    "PRECISE-02": {"status": "pass", "mechanism": "rust-analyzer", "evidence": ["crates/chakra-provider-rust-analyzer/tests/lifecycle.rs"]},
    "PRECISE-03": {"status": "pass", "mechanism": "chakra-provider-rust-analyzer", "evidence": ["crates/chakra-provider-rust-analyzer/tests/lifecycle.rs"]},
    "PRECISE-04": {"status": "pass", "mechanism": "chakra-provider-rust-analyzer", "evidence": ["crates/chakra-provider-rust-analyzer/tests/lifecycle.rs"]},
    "PRECISE-05": {"status": "pass", "mechanism": "syntax fallback", "evidence": ["crates/chakra-provider-rust-analyzer/tests/lifecycle.rs"]},
    "QUERY-01": {"status": "pass", "mechanism": "chakra-engine QueryService", "evidence": ["crates/chakra-engine/tests/scenario.rs"]},
    "QUERY-02": {"status": "pass", "mechanism": "chakra-mcp", "evidence": ["crates/chakra-mcp/tests/contract.rs"]},
    "QUERY-03": {"status": "pass", "mechanism": "chakra-git diff provider", "evidence": ["crates/chakra-git/tests/diff_scopes.rs", "docs/support/conformance/rust.json"]},
    "FRESH-01": {"status": "pass", "mechanism": "atomic revision publication (ADR-0001)", "evidence": ["crates/chakra-engine/tests/atomic_revisions.rs"]},
    "FRESH-02": {"status": "pass", "mechanism": "live freshness barrier (ADR-0005)", "evidence": ["crates/chakra-engine/tests/freshness.rs"]},
    "PROV-01": {"status": "pass", "mechanism": "domain provenance model", "evidence": ["crates/chakra-engine/tests/scenario.rs"]},
    "AMBIG-01": {"status": "pass", "mechanism": "query-layer ambiguity reporting", "evidence": ["crates/chakra-engine/tests/scenario.rs"]},
    "BUDGET-01": {"status": "pass", "mechanism": "query work budgets (ADR-0025)", "evidence": ["crates/chakra-engine/tests/query_work_budgets.rs"]},
    "CANCEL-01": {"status": "pass", "mechanism": "cooperative cancellation (ADR-0012)", "evidence": ["crates/chakra-engine/tests/query_work_budgets.rs"]},
    "DEGRADE-01": {"status": "pass", "mechanism": "bounded degradation (ADR-0011)", "evidence": ["crates/chakra-engine/tests/query_work_budgets.rs"]},
    "CONFORM-01": {"status": "pass", "mechanism": "chakra-conformance harness", "evidence": ["docs/support/conformance/rust.json"]},
    "CORPUS-01": {"status": "pass", "mechanism": "pinned public corpus evaluation (ADR-0029)", "evidence": ["docs/support/corpus/results/rust-tokio-rs__tokio.json", "docs/support/corpus/results/rust-BurntSushi__ripgrep.json"]},
    "DOCS-01": {"status": "pass", "mechanism": "per-language documentation", "evidence": ["docs/languages/rust.md"]}
  },
  "conformance_results": "docs/support/conformance/rust.json",
  "corpus_results": "docs/support/corpus/results/rust-tokio-rs__tokio.json",
  "docs": "docs/languages/rust.md"
}
