{
  "language": "php",
  "advertised": true,
  "tier": "first-class",
  "grammar": {
    "name": "tree-sitter-php",
    "version": "0.24.2",
    "adr": "docs/adr/0008-php-syntax-and-language-composition.md"
  },
  "precise_provider": {
    "name": "none",
    "adr": "docs/adr/0018-php-precise-provider-evaluation.md",
    "status": "deferred"
  },
  "capabilities": {
    "DISC-01": {"status": "pass", "mechanism": "chakra-git discovery", "evidence": ["crates/chakra-language-php/tests/fixture_index.rs"]},
    "DISC-02": {"status": "pass", "mechanism": "composer-aware scopes", "evidence": ["crates/chakra-git/src/source_metadata.rs", "docs/support/conformance/php.json"]},
    "DISC-03": {"status": "pass", "mechanism": "language-neutral source roles (ADR-0019)", "evidence": ["crates/chakra-git/src/source_metadata.rs", "docs/support/conformance/php.json"]},
    "SYNTAX-01": {"status": "pass", "mechanism": "tree-sitter-php 0.24.2", "evidence": ["Cargo.toml"]},
    "SYNTAX-02": {"status": "pass", "mechanism": "tree-sitter", "evidence": ["crates/chakra-language-php/tests/fixture_index.rs"]},
    "SYNTAX-03": {"status": "pass", "mechanism": "tree-sitter", "evidence": ["crates/chakra-language-php/tests/fixture_index.rs"]},
    "SYNTAX-04": {"status": "pass", "mechanism": "tree-sitter", "evidence": ["crates/chakra-language-php/tests/fixture_index.rs"]},
    "SYNTAX-05": {"status": "pass", "mechanism": "tree-sitter", "evidence": ["crates/chakra-language-php/tests/fixture_index.rs"]},
    "SYNTAX-06": {"status": "pass", "mechanism": "tree-sitter + PHPUnit conventions", "evidence": ["crates/chakra-language-php/tests/fixture_index.rs"]},
    "SYNTAX-07": {"status": "pass", "mechanism": "tree-sitter diagnostics (ADR-0022)", "evidence": ["crates/chakra-language-php/tests/fixture_index.rs"]},
    "SYNTAX-08": {"status": "pass", "mechanism": "receiver-aware syntax call resolution (ADR-0015)", "evidence": ["crates/chakra-language-php/tests/fixture_index.rs"]},
    "PRECISE-01": {"status": "pass", "mechanism": "recorded deferral with shipped equivalent", "evidence": ["docs/adr/0018-php-precise-provider-evaluation.md", "docs/adr/0030-php-precise-equivalent-resolver.md", "docs/evaluation/php-provider-v0.1.1.md"]},
    "PRECISE-02": {"status": "equivalent", "mechanism": "ChakraResolver strict-tier promotion (ADR-0030)", "evidence": ["crates/chakra-language-php/src/indexer/catalog.rs", "crates/chakra-language-php/src/indexer/tests.rs", "crates/chakra-language-php/tests/fixture_index.rs", "docs/adr/0030-php-precise-equivalent-resolver.md"]},
    "PRECISE-03": {"status": "not-applicable", "note": "No provider integrated."},
    "PRECISE-04": {"status": "not-applicable", "note": "No provider integrated."},
    "PRECISE-05": {"status": "not-applicable", "note": "No provider integrated."},
    "QUERY-01": {"status": "pass", "mechanism": "chakra-engine QueryService", "evidence": ["crates/chakra-engine/tests/scenario.rs"]},
    "QUERY-02": {"status": "pass", "mechanism": "chakra-mcp", "evidence": ["crates/chakra-mcp/tests/contract.rs"]},
    "QUERY-03": {"status": "pass", "mechanism": "chakra-git diff provider", "evidence": ["docs/support/conformance/php.json"]},
    "FRESH-01": {"status": "pass", "mechanism": "atomic revision publication (ADR-0001)", "evidence": ["crates/chakra-engine/tests/atomic_revisions.rs"]},
    "FRESH-02": {"status": "pass", "mechanism": "live freshness barrier (ADR-0005)", "evidence": ["crates/chakra-engine/tests/freshness.rs"]},
    "PROV-01": {"status": "pass", "mechanism": "domain provenance model", "evidence": ["crates/chakra-engine/tests/scenario.rs"]},
    "AMBIG-01": {"status": "pass", "mechanism": "query-layer ambiguity reporting", "evidence": ["crates/chakra-engine/tests/scenario.rs"]},
    "BUDGET-01": {"status": "pass", "mechanism": "query work budgets (ADR-0025)", "evidence": ["crates/chakra-engine/tests/query_work_budgets.rs"]},
    "CANCEL-01": {"status": "pass", "mechanism": "cooperative cancellation (ADR-0025)", "evidence": ["crates/chakra-engine/tests/query_work_budgets.rs"]},
    "DEGRADE-01": {"status": "pass", "mechanism": "bounded degradation (ADR-0011)", "evidence": ["crates/chakra-engine/tests/query_work_budgets.rs"]},
    "CONFORM-01": {"status": "pass", "mechanism": "chakra-conformance harness", "evidence": ["docs/support/conformance/php.json"]},
    "CORPUS-01": {"status": "pass", "mechanism": "pinned public corpus evaluation (ADR-0029)", "evidence": ["docs/support/corpus/results/php-laravel__framework.json", "docs/support/corpus/results/php-symfony__symfony.json"]},
    "DOCS-01": {"status": "pass", "mechanism": "per-language documentation", "evidence": ["docs/languages/php.md"]}
  },
  "conformance_results": "docs/support/conformance/php.json",
  "corpus_results": "docs/support/corpus/results/php-laravel__framework.json",
  "docs": "docs/languages/php.md"
}
